{
  "pov": "You said \"I'm boring\" at the party instead of \"I'm bored\"",
  "emoji": "😐",
  "punchline": "Everyone now thinks YOU are the boring one.",
  "lesson": "**-ed** = nasıl hissediyorsun (I'm ==bored==). **-ing** = ne/kim öyle (The party is ==boring==).",
  "cta": "Tag that friend 😅 · Kaydet 🔖",
  "meta": {
    "topic": "bored vs boring",
    "caption": "POV: Partide \"I'm boring\" dedin 😐\n\nHerkes senin sıkıcı olduğunu düşünüyor… Çünkü:\n-ed = nasıl hissettiğin → I'm bored (sıkıldım)\n-ing = o şeyin özelliği → The party is boring (parti sıkıcı)\n\nAynı hatayı \"interested/interesting\", \"excited/exciting\" için de yapıyoruz 😅\n\nBunu yapan arkadaşını etiketle 👇 Kaydet 🔖\n\nBored vs boring: -ed is how you feel, -ing describes the thing.",
    "hashtags": ["#ingilizce", "#ahkakademi", "#ingilizcememe", "#learnenglish", "#boredvsboring", "#grammar", "#ingilizceöğreniyorum", "#englishmemes", "#ielts", "#speakenglish", "#funnyenglish"],
    "audio_mood": "awkward silence then a trending 'oh no' / vine boom at the punchline"
  }
}
